{
  "_source": "Per-chapter 'Last edited:' timestamps harvested from the FicHub EPUB. SV records date-only; FicHub preserves it verbatim. Chapters never edited post-publish do not carry the stamp — those rows have last_edited_known=false.",
  "_count": 194,
  "_with_timestamp": 185,
  "_without_timestamp_count": 9,
  "_without_timestamp_chapters": [
    "9",
    "12",
    "12.1",
    "14",
    "16",
    "17",
    "18",
    "19",
    "116.1"
  ],
  "chapters": [
    {
      "chapter_num": "1",
      "full_title": "1 Introduction",
      "last_edited_at": "2020-12-10",
      "last_edited_known": true,
      "edited_lag_days": 144
    },
    {
      "chapter_num": "2",
      "full_title": "2 Preparation",
      "last_edited_at": "2020-12-10",
      "last_edited_known": true,
      "edited_lag_days": 144
    },
    {
      "chapter_num": "3",
      "full_title": "3 First Fight",
      "last_edited_at": "2020-12-10",
      "last_edited_known": true,
      "edited_lag_days": 144
    },
    {
      "chapter_num": "3.1",
      "full_title": "3.1 Interlude: Brian",
      "last_edited_at": "2020-12-10",
      "last_edited_known": true,
      "edited_lag_days": 143
    },
    {
      "chapter_num": "4",
      "full_title": "4 Recovery",
      "last_edited_at": "2021-07-16",
      "last_edited_known": true,
      "edited_lag_days": 361
    },
    {
      "chapter_num": "5",
      "full_title": "5 Negotiation",
      "last_edited_at": "2021-07-16",
      "last_edited_known": true,
      "edited_lag_days": 360
    },
    {
      "chapter_num": "6",
      "full_title": "6 Commission",
      "last_edited_at": "2020-12-10",
      "last_edited_known": true,
      "edited_lag_days": 142
    },
    {
      "chapter_num": "6.1",
      "full_title": "6.1 Interlude: Taylor",
      "last_edited_at": "2020-09-26",
      "last_edited_known": true,
      "edited_lag_days": 66
    },
    {
      "chapter_num": "7",
      "full_title": "7 Accessory",
      "last_edited_at": "2021-07-16",
      "last_edited_known": true,
      "edited_lag_days": 359
    },
    {
      "chapter_num": "8",
      "full_title": "8 Aftermath",
      "last_edited_at": "2021-07-16",
      "last_edited_known": true,
      "edited_lag_days": 358
    },
    {
      "chapter_num": "8.1",
      "full_title": "8.1 Interlude: Amy",
      "last_edited_at": "2021-07-16",
      "last_edited_known": true,
      "edited_lag_days": 358
    },
    {
      "chapter_num": "9",
      "full_title": "9 Acquisitions",
      "last_edited_at": null,
      "last_edited_known": false,
      "edited_lag_days": null
    },
    {
      "chapter_num": "10",
      "full_title": "10 Overhaul",
      "last_edited_at": "2020-12-10",
      "last_edited_known": true,
      "edited_lag_days": 139
    },
    {
      "chapter_num": "11",
      "full_title": "11 Power Trip",
      "last_edited_at": "2021-07-16",
      "last_edited_known": true,
      "edited_lag_days": 356
    },
    {
      "chapter_num": "12",
      "full_title": "12 Conference",
      "last_edited_at": null,
      "last_edited_known": false,
      "edited_lag_days": null
    },
    {
      "chapter_num": "12.1",
      "full_title": "12.1 Interlude: Thomas",
      "last_edited_at": null,
      "last_edited_known": false,
      "edited_lag_days": null
    },
    {
      "chapter_num": "13",
      "full_title": "13 Exposure",
      "last_edited_at": "2020-12-10",
      "last_edited_known": true,
      "edited_lag_days": 137
    },
    {
      "chapter_num": "14",
      "full_title": "14 Debut",
      "last_edited_at": null,
      "last_edited_known": false,
      "edited_lag_days": null
    },
    {
      "chapter_num": "15",
      "full_title": "15 Recuperation",
      "last_edited_at": "2020-07-27",
      "last_edited_known": true,
      "edited_lag_days": 0
    },
    {
      "chapter_num": "16",
      "full_title": "16 Therapy",
      "last_edited_at": null,
      "last_edited_known": false,
      "edited_lag_days": null
    },
    {
      "chapter_num": "16.1",
      "full_title": "16.1 Interlude Weld",
      "last_edited_at": "2020-07-29",
      "last_edited_known": true,
      "edited_lag_days": 1
    },
    {
      "chapter_num": "17",
      "full_title": "17 Confrontation",
      "last_edited_at": null,
      "last_edited_known": false,
      "edited_lag_days": null
    },
    {
      "chapter_num": "18",
      "full_title": "18 Regroup",
      "last_edited_at": null,
      "last_edited_known": false,
      "edited_lag_days": null
    },
    {
      "chapter_num": "19",
      "full_title": "19 Restoration",
      "last_edited_at": null,
      "last_edited_known": false,
      "edited_lag_days": null
    },
    {
      "chapter_num": "20",
      "full_title": "20 Offensive",
      "last_edited_at": "2021-07-16",
      "last_edited_known": true,
      "edited_lag_days": 351
    },
    {
      "chapter_num": "21",
      "full_title": "21 Closing Moves",
      "last_edited_at": "2020-08-01",
      "last_edited_known": true,
      "edited_lag_days": 1
    },
    {
      "chapter_num": "21.1",
      "full_title": "21.1 Interlude: Dennis",
      "last_edited_at": "2020-09-19",
      "last_edited_known": true,
      "edited_lag_days": 45
    },
    {
      "chapter_num": "22",
      "full_title": "22 Homeward",
      "last_edited_at": "2020-08-14",
      "last_edited_known": true,
      "edited_lag_days": 2
    },
    {
      "chapter_num": "23",
      "full_title": "23 Renovation - Addendum Taylor",
      "last_edited_at": "2021-07-29",
      "last_edited_known": true,
      "edited_lag_days": 344
    },
    {
      "chapter_num": "24",
      "full_title": "24 Tech Work - Addendum Alec",
      "last_edited_at": "2020-08-27",
      "last_edited_known": true,
      "edited_lag_days": 1
    },
    {
      "chapter_num": "25",
      "full_title": "25 Search and Rescue - Addendum PHO",
      "last_edited_at": "2021-07-29",
      "last_edited_known": true,
      "edited_lag_days": 329
    },
    {
      "chapter_num": "26",
      "full_title": "26 Correspondence - Addendum Rory",
      "last_edited_at": "2020-09-11",
      "last_edited_known": true,
      "edited_lag_days": 1
    },
    {
      "chapter_num": "27",
      "full_title": "27 Intrusion - Addendum Hannah",
      "last_edited_at": "2021-07-29",
      "last_edited_known": true,
      "edited_lag_days": 315
    },
    {
      "chapter_num": "28",
      "full_title": "28 Preamble - Addendum Sophia",
      "last_edited_at": "2021-07-29",
      "last_edited_known": true,
      "edited_lag_days": 308
    },
    {
      "chapter_num": "29",
      "full_title": "29 Presentation - Addendum Emily",
      "last_edited_at": "2021-07-29",
      "last_edited_known": true,
      "edited_lag_days": 301
    },
    {
      "chapter_num": "30",
      "full_title": "30 Crescendo - Addendum Missy",
      "last_edited_at": "2021-07-29",
      "last_edited_known": true,
      "edited_lag_days": 288
    },
    {
      "chapter_num": "31",
      "full_title": "31 Consensus - Preamble PHO - Addendum Accord",
      "last_edited_at": "2021-07-29",
      "last_edited_known": true,
      "edited_lag_days": 281
    },
    {
      "chapter_num": "32",
      "full_title": "32 Family Fugue - Preamble Taylor - Addendum Mike",
      "last_edited_at": "2021-07-29",
      "last_edited_known": true,
      "edited_lag_days": 273
    },
    {
      "chapter_num": "33",
      "full_title": "33 Morning Training - Preamble James - Addendum Youth Guard",
      "last_edited_at": "2020-11-17",
      "last_edited_known": true,
      "edited_lag_days": 5
    },
    {
      "chapter_num": "34",
      "full_title": "34 Little Talks - Addendum Ethan",
      "last_edited_at": "2020-12-03",
      "last_edited_known": true,
      "edited_lag_days": 15
    },
    {
      "chapter_num": "35",
      "full_title": "35 Closing Words - Addendum Chris",
      "last_edited_at": "2021-07-29",
      "last_edited_known": true,
      "edited_lag_days": 245
    },
    {
      "chapter_num": "35.1",
      "full_title": "35.1 Interlude Dragon - Addendum Margaret",
      "last_edited_at": "2021-07-29",
      "last_edited_known": true,
      "edited_lag_days": 238
    },
    {
      "chapter_num": "36",
      "full_title": "36 Debrief - Addendum The Bay Bulletin",
      "last_edited_at": "2020-12-17",
      "last_edited_known": true,
      "edited_lag_days": 7
    },
    {
      "chapter_num": "37",
      "full_title": "37 Small Tasks - Addendum Meeting Report",
      "last_edited_at": "2020-12-19",
      "last_edited_known": true,
      "edited_lag_days": 2
    },
    {
      "chapter_num": "38",
      "full_title": "38 Build Up - Preamble Leet - Addendum Rey",
      "last_edited_at": "2021-07-29",
      "last_edited_known": true,
      "edited_lag_days": 210
    },
    {
      "chapter_num": "39",
      "full_title": "39 Set Up - Addendum Kenta",
      "last_edited_at": "2021-07-29",
      "last_edited_known": true,
      "edited_lag_days": 204
    },
    {
      "chapter_num": "40",
      "full_title": "40 Knock Down - Preamble Gully - Addendum Emergency Alert",
      "last_edited_at": "2021-01-18",
      "last_edited_known": true,
      "edited_lag_days": 5
    },
    {
      "chapter_num": "41",
      "full_title": "41 Drag Out - Preamble Chen",
      "last_edited_at": "2021-04-10",
      "last_edited_known": true,
      "edited_lag_days": 72
    },
    {
      "chapter_num": "41.1",
      "full_title": "41.1 Interlude Victoria",
      "last_edited_at": "2021-02-11",
      "last_edited_known": true,
      "edited_lag_days": 0
    },
    {
      "chapter_num": "41.2",
      "full_title": "41.2 Interlude Vicky",
      "last_edited_at": "2021-02-27",
      "last_edited_known": true,
      "edited_lag_days": 9
    },
    {
      "chapter_num": "41.3",
      "full_title": "41.3 Interlude Glory Girl",
      "last_edited_at": "2021-03-05",
      "last_edited_known": true,
      "edited_lag_days": 1
    },
    {
      "chapter_num": "42",